id,title,category,area,year,scale,summary
work1,店舗 照明・配線設備工事,電気,東京都大田区,2025,物販店舗,店舗リニューアルに合わせ、天井照明とコンセント配線を全面更新。営業を止めない夜間施工で対応しました。
work2,業務用エアコン入替工事,空調,東京都品川区,2025,オフィス,老朽化した天井カセット形エアコンを入替。配管・ドレンも合わせて点検し、空調効率を改善しました。
work3,給湯・給水設備の改修工事,給排水,東京都大田区,2024,戸建て住宅,屋外の給湯器と給水配管を更新。漏水リスクを抑えつつ、快適な水まわり環境を整えました。
work4,住宅 コンセント増設・電気工事,電気,東京都目黒区,2024,戸建て住宅,家電の増加に合わせてコンセントを増設し、分電盤まわりも見直し。安全に使える配線へ整えました。
work5,厨房 ダクト・換気設備工事,空調,東京都大田区,2024,飲食店,飲食店の厨房ダクトと換気設備を施工。油汚れに配慮した清掃しやすい構成を採用しました。
work6,ガス管配管工事,給排水,東京都品川区,2023,集合住宅,集合住宅のガス管配管を更新。気密試験を徹底し、安全性を最優先に施工しました。
work7,冷凍冷蔵設備 設置工事,空調,東京都大田区,2023,小売店,小売店向けの冷凍冷蔵設備を設置。電源・冷媒配管まで一貫して対応しました。
